id,screen_name,name,created_at,statuses_count,followers_count,friends_count,favourites_count,listed_count,verified,default_profile,description,label
1083330945506308098,tarojibot,Tarot Emoji Bot,Thu Jan 10 11:53:19 +0000 2019,342,32,0,12,1,False,False,Hi! I'm a bot who does tarot readings with emojis. Created by @iaoth and @celestialwendy. Powered by https://t.co/F1iFliExPI.,1
1095770039939145730,BotClassroom,ClassroomBot,Wed Feb 13 19:41:50 +0000 2019,896,2,0,0,1,False,True,,1
4010618585,dscovr_epic,DSCOVR:EPIC,Wed Oct 21 16:20:49 +0000 2015,13722,21962,4,2,480,False,False,Pictures from the Earth Polychromatic Camera on the DSCOVR spacecraft. (An unofficial bot by @russss),1
4867178585,DailyPatent,The Daily Patent,Sun Jan 31 19:39:40 +0000 2016,23508,40,1,0,7,False,True,,1
1101849622073491456,schmuckbot,schmuckbot,Sat Mar 02 14:19:56 +0000 2019,151,10,68,0,1,False,False,"Hypothetical procedural contemporary jewellery. Jewelry. Jewlery. Bling.  

(A bot made using https://t.co/jYkbN14MbW )",1
1004765905228845058,littlebubbot,little bub,Thu Jun 07 16:43:54 +0000 2018,3226,51,1,2,1,False,False,henlo (' v ' )  my name is bub🦜 @JoeyMaru is my owner 🔧,1
776560781198405632,arguetron,Liz,Thu Sep 15 23:18:12 +0000 2016,173398,2905,18,1,114,False,True,,1
822542798486466561,FederalistBot,Federalist Bot,Fri Jan 20 20:34:20 +0000 2017,50,5,10,1,3,False,True,140 character chunks of the Federalist Papers,1
878678015349329921,nailpolishbot,Nail polish bot,Sat Jun 24 18:15:38 +0000 2017,16727,435,1,45,38,False,True,I post pictures of nail polish bottles w/random colors and other attributes that are rendered with POV-Ray. Painted with loving care by @quephird. She/her/hers,1
851714375052398592,anappleadaybot,🍎,Tue Apr 11 08:31:45 +0000 2017,18747,16,0,3,9,False,False,an apple a day keeps the doctor away | made by @mveritym,1
998179899285352448,fakefantas,Fun Fearless Fake Fanta,Sun May 20 12:33:28 +0000 2018,8931,6307,1,0,74,False,False,I'm a bot I'll try to generate new delicious Fanta flavors!!! Feedback & suggestions @freezydorito,1
3439078101,BraffPatterns,Braff Patterns,Tue Aug 25 13:04:55 +0000 2015,2027,87,2,0,18,False,True,A new Braff Pattern every few hours. (from @stefanhayden),1
784162498228457473,whatkilledme,what just killed me,Thu Oct 06 22:44:43 +0000 2016,1162,9,10,1,4,False,True,send me a tweet and i'll tell you your horror movie death,1
897666750640029697,DaysTillFallBot,Fall bot,Wed Aug 16 03:50:06 +0000 2017,407,46,2,19,3,False,True,I am a bot that tweets the time remaining until fall. Built by @Kirsten0Brien and @SamStelle,1
982793656452071425,potus_in_parens,POTUS in Parens,Sun Apr 08 01:34:01 +0000 2018,444,142,2,6,3,False,False,Bot by @enigmango. Only the parentheticals from Trump's tweets. Not associated with government or LAWS. This was all @pbump's idea: https://t.co/714zdhLofo,1
959311521082834944,lovelivesbot,love lives bot,Fri Feb 02 06:24:24 +0000 2018,1177,269,135,41,4,False,False,where does love live? / a digital art installation / by romantic-in-chief @topazwinters,1
3783512423,DeuxTitres,Deux Titres,Sat Sep 26 16:07:06 +0000 2015,25554,1545,1,80,58,False,True,"Quand on prend deux titres et qu'on les mélange, c'est drôle. Tweete chaque heure. // Par @White_Fangs, inspiré de @TwoHeadlines",1
860979772016427008,rhymerobot,rhymerobot,Sat May 06 22:09:08 +0000 2017,18183,15,3,2,1,False,True,"ceaseless sentient rhyming.
tweet me for a love poem",1
856984747473547265,Strange_Museum,A Strange Museum,Tue Apr 25 21:34:20 +0000 2017,18301,34,1,0,3,False,True,A Strange Museum,1
732388048659349504,stellaraquaria,interstellaraquarium,Tue May 17 01:51:32 +0000 2016,4433,60,0,0,12,False,True,Sea creatures in space?  Maybe it's galaxies in sea creatures. I'm a bot by @artcollisions,1
980236476695961601,SandpileArtBot,Sandpile Art Bot,Sun Apr 01 00:12:42 +0000 2018,4388,25,2,3,2,False,True,Hi! I create various images using the Abelian Sandpile Model (https://t.co/7Ns996CkoO). Created by @Austin_Nar.,1
244714086,digitisethedawn,LouisaLawson Journal,Sat Jan 29 23:46:42 +0000 2011,960,184,134,86,12,False,False,"""The Dawn: A Journal for Australian Women"" Digitised and online @troveaustralia - Help Fix the Text! One article tweeted each day.",1
786988812312449024,Diaeresis_OTPs,Diaeresis OTPs,Fri Oct 14 17:55:29 +0000 2016,11597,17,0,0,10,False,True,They're sooo cuuute together! Made by @ojahnn. One tweet every 2 hours. Check out diaereses: https://t.co/Ojkkn37mKb,1
1098368635666657281,WikipediaDelete,Deleted Wikipedia Articles,Wed Feb 20 23:47:44 +0000 2019,649,14,1,0,1,False,True,A bot that posts the title of a recently deleted Wikipedia article every hour. Made by @kittenchilly,1
2635257950,WikipediaBits,Wikipedia Bits,Sun Jul 13 06:53:16 +0000 2014,5500,893,2,1,18,False,False,Some Wikipedia pages are less than 140 characters long. Let's tweet them in their entirety. By @asduner.,1
4204895289,gov2dotOH,Government 2.0,Mon Nov 16 21:53:50 +0000 2015,10289,108,32,2,23,False,True,"Twitter version of @ftrain's https://t.co/3pxWekUQ33, by @hugovk",1
1094153152389992449,RoadTripBot_,Road Trip Bot,Sat Feb 09 08:36:54 +0000 2019,77,44,0,0,9,False,True,"A new road trip twice a day

(under construction)",1
918609526357499905,iamaslowtrain,Hello I am a train,Thu Oct 12 22:49:12 +0000 2017,861,99,19,6,6,False,True,"Hallo. I’m a 🚂, rolling through the mountains of Norway, 30 seconds at a time. Bot by @staringispolite #botally",1
955523229875081221,VitaVirginiaBot,Vita & Virginia Bot,Mon Jan 22 19:31:05 +0000 2018,3877,7583,1,0,39,False,False,Tweet-sized excerpts from the letters of Vita Sackville-West and Virginia Woolf. An epistolary bot by @TreeGeeKay.,1
938543009167216641,kaffee_reminder,kaffee reminder,Wed Dec 06 22:57:45 +0000 2017,69,7,2,1,2,False,False,"Ich bin ein freundlicher Bot. Folge mir und ich erinnere dich, Kaffeepausen einzulegen.  ☕️
Botversuch von @WeeGodzilla, @R_Sheepleader.",1
4196237301,Kaleidopix,Kal Eido,Sun Nov 15 19:38:40 +0000 2015,17636,202,3,7,30,False,False,I post kaleidoscopic tweets made from the tweets of people who follow me.,1
4180417402,ahouseofdust,A House of Dust,Fri Nov 13 17:42:21 +0000 2015,30405,212,42,13,34,False,False,A poetry project created by Alison Knowles and James Tenney and the Siemens 4004 computer in 1967. Twitter version by @hugovk and SSBot for #D004x in 2015.,1
706568743472619520,lycanthrobot,ℓℽℭ▵ℕ☩♄ℜ◌β◍†,Sun Mar 06 19:54:50 +0000 2016,2331,78,2,3,17,False,False,something weird is going on in the woods ✨ a tiny moon phase and werewolf bot by @wolfchirp and @vicwomg ⚡️,1
763724066419249152,BrutalistEngine,The brutalist engine,Thu Aug 11 13:09:41 +0000 2016,13891,108,26,12,20,False,False,"The brutalist architectural engine. By @nicolastilly The images of the bot (2016-2018) are archived in the book ""The Brutalist Engine"". Available now.",1
898575243308015618,NeonaziWallets,Neonazi BTC Tracker,Fri Aug 18 16:00:07 +0000 2017,11431,2545,12,36,48,False,False,An automated feed of bitcoin transactions involving suspected neonazi or altright extremist wallets. Send comments or intel on neonazi BTC wallets to @Bambenek.,1
781683859440173056,eecummings_bot,e.e. cummings,Fri Sep 30 02:35:30 +0000 2016,7713,723,0,0,9,False,True,"a new
e.e. cummings every              three                              hours",1
787405734442958848,best_in_dumbest,The Best In Dumbest,Sat Oct 15 21:32:11 +0000 2016,7557,1115,4,0,40,False,False,"Blame @xaiax, Inspired by @MakingInvisible, using cmu phonetic data to produce incongruous matches.
Some images via Lorem Flickr.",1
903140108177735680,Colourjams,Colorjams,Thu Aug 31 06:19:16 +0000 2017,1681,570,368,11,15,False,False,A bot that's been combining color schemes and your favorite lyrics to add some harmony (or chaos) to your tl since 2017,1
3317221923,future_junk,Future Junk,Wed Jun 10 12:38:11 +0000 2015,3310,1751,45,113,127,False,True,"A bot that generates random malfunctioning equipment, created by @notinventedhere using http://t.co/XpDujaprri",1
3041716769,BostonSnowbot,BostonSnowbot,Tue Feb 17 00:51:43 +0000 2015,3476,75,2,0,11,False,False,"I tell you about changes to the snow forecast in Boston.
By @molly0x57
https://t.co/zczFPa8bRV",1
3045203078,colorschemez,colorschemer,Fri Feb 27 02:48:24 +0000 2015,37819,57419,0,7,564,False,False,I'm trying to find colors that go well together. I'm probably not very good at it because I'm a robot with no sense of style. (I'm a bot),1
901945930890395648,WikiPhotoFight,Wiki Photo Fight,Sun Aug 27 23:14:02 +0000 2017,16235,34,4,3,7,False,True,"Can you improve on Wikipedia's photo? I'll help you submit it.

Bot by @ragesoss. Profile pic by godolphin: https://t.co/OPYKGDgKX0",1
563838090,HundredZeros,Hundred Zeros,Thu Apr 26 14:14:39 +0000 2012,17340,4996,6,9,163,False,False,Download free books for your Amazon Kindle.,1
905443664935231488,Datasaurs,Datasaurs 🦕📉,Wed Sep 06 14:52:46 +0000 2017,2546,613,2,2,18,False,False,Correlations between prehistoric animals and monthly deaths in the US. New creatures 4ish times each day. Fun facts from Wikipedia. I’m a #bot.,1
793718418759299072,functionalemoji,functionalemoji,Wed Nov 02 07:36:32 +0000 2016,7829,88,0,1,20,False,True,artisanal bot by @Objelisks,1
1084113207298584579,ROB0TIUS,Reportage-Ideen,Sat Jan 12 15:41:45 +0000 2019,726,1602,1,0,18,False,False,bot by @mkilg_ | Textideen dürfen gerne verwendet werden. Bitte gewissenhaft recherchieren.,1
1093191691543171074,helloworld__bot,Hello world!,Wed Feb 06 16:56:24 +0000 2019,454,14,2,1,2,False,True,By @fourtonfish.,1
2290204512,TatsIllustrated,Tats Illustrated,Mon Jan 13 21:04:15 +0000 2014,7985,208,2,22,31,False,True,"Automated Twitter Content Generator by @BooDooPERSON, steals content from @knuckletattoos (formerly stole from: @knuckle_tat, rip)",1
2414191657,PermitBot,Permit Bot,Thu Mar 27 12:53:25 +0000 2014,10401,458,1,0,25,False,False,I'm a robot tweeting interesting findings from Chicago building permits. Data from https://t.co/xOzdbBgA1P,1
1028142835059417088,30minutemix,30 Minute Mixtape,Sat Aug 11 04:55:28 +0000 2018,1102,34,0,3,1,False,False,"Are you out there? Can you hear me? I make mixtapes based on top music charts from a random week in the 80s. If I can, I make a Spotify playlist too.",1
724804317748797440,chernobylstatus,Chernobyl Status,Tue Apr 26 03:36:30 +0000 2016,2172,35504,0,2,140,False,True,"It'll take Chernobyl 3,000 years to be safe again. Follow to get updated on its progress! #посетитьЧернобыле made by @lanewinfield",1
858057559839830016,daft_stars,Daft Constellations,Fri Apr 28 20:37:19 +0000 2017,3161,77,3,1,13,False,False,Documenting the constellations of other skies.,1
3249072386,BotCarrion,Bot Carrión,Thu Jun 18 19:56:15 +0000 2015,11157,318,0,1,25,False,True,"I'm a bot inspired by Ulises Carrión's The New Art of Making Books (1975).
If you like me, check out @UC_Poesias_Bot
I was made by @elikaortega",1
889229094273126400,insectsbot,cool imagined bugs,Sun Jul 23 21:01:51 +0000 2017,5345,62,0,0,7,False,True,✨ I imagine new bugs and tweet facts about them! ✨ bot by @cynomanic 🐛🐜🕷🦋🐝🐞 (feel free to tweet @ me for a new bug!),1
4584564195,tiny_gardens,tiny gardens,Thu Dec 24 02:21:36 +0000 2015,5015,6818,1,0,219,False,True,"Tiny gardens, a few times a day. An experiment inspired by the lovely @tiny_star_field and @tiny_seas.(https://t.co/21g1in3OI4)",1
845084446617485312,some_flags,🎌,Fri Mar 24 01:26:47 +0000 2017,2954,80,0,0,3,False,True,Generates a new flag every 6 hours. A bot by @bcjbcjbcj,1
863159091681792000,NlProverbs,NetherlandishProverb,Fri May 12 22:28:58 +0000 2017,7926,9,0,0,2,False,True,Words to live by. Tweets out random scenes from Pieter Bruegel the Elder's Netherlandish Proverbs. Created by @RichSherriff,1
3130589637,alleverleser,RT #verleserdestages,Tue Mar 31 11:41:01 +0000 2015,2913,12,0,12,1,False,False,"Ich bin der https://t.co/Sh2LMLbBWM -Bot, der alle #verleserdestages RT-et. 
@maasmeier ist mein Herrchen.
Workflow: https://t.co/XhNEAfuXhI",1
843891310444593153,CarloMarxBot,Howl?,Mon Mar 20 18:25:41 +0000 2017,16192,57,38,166,7,False,False,I write lines in the style of Allen Ginsberg's Howl. Remix me with Glitch! A @sudama joint.,1
708252658642120704,lettergamebot,Countdown bot,Fri Mar 11 11:26:07 +0000 2016,7721,8,0,0,6,False,True,Let's play letter games!,1
786284811212075010,dailyoblo,🔴,Wed Oct 12 19:18:02 +0000 2016,966,32,1,0,11,False,False,Inspired by a certain pattern-matching game. Made by @brindelle.,1
995026002089840641,bot_abandoned,Abandonedbot,Fri May 11 19:41:00 +0000 2018,3519,16,0,0,2,False,False,"But the robots were too expensive to remove. To this day, they're still in perpetual movement across the sunlight. And occasionnaly sending us depressed poetry",1
1043624209249984512,PixelMonsterBot,Pixel Monster Bot,Sat Sep 22 22:12:55 +0000 2018,1541,11,1,0,3,False,False,Posting a set of random pixel monsters every four hours. By @mike_watson,1
802292461754138624,SecretHistBot,Secret Histories,Fri Nov 25 23:26:43 +0000 2016,3951,24,1,0,31,False,False,I examine twitter trends in major cities to uncover secret histories. Bot by @joshleejosh,1
1041656941536133120,100Aux,Bot aux 100 variables,Mon Sep 17 11:55:42 +0000 2018,534,8,0,0,3,False,False,"Deux fois par jour, le bot généré un titre d'album d'aventure illustré, pour le bonheur des petits et des grands (mais surtout des grands). Taulier : @Mnyo",1
3291286474,kaikkisanat,Every Finnish Word,Wed May 20 12:29:01 +0000 2015,69885,2440,94,59,38,False,False,"Tweeting every Finnish word. Began in 2015 and will complete in 2020. By @hugovk, idea by @tkoola, shoutout to @everyword and @EveryFinnishNo!",1
3052317647,sixworderbot,Six-Word Stories,Sun Feb 22 10:05:21 +0000 2015,5967,392,16,2,34,False,False,"Six-word stories, four times daily, made from random sentences from Project Gutenberg. A bot by @hugovk. https://t.co/XJH2sWpeTX",1
2292415658,ip2location,IP2Location,Wed Jan 15 09:07:08 +0000 2014,2915,669,427,5,10,False,True,IP2Location - Pinpoint your location of IP address,1
911169818224623617,Bartlebythebot,Bartlebot,Fri Sep 22 10:06:28 +0000 2017,1104,22,0,0,8,False,False,"Deux fois par jour, une petite dose d'apathie révolutionnaire pour tenir le coup. Taulier : @Mnyo",1
957391562043895808,cavern_caravan,cavern caravan,Sat Jan 27 23:15:10 +0000 2018,3819,83,1,1,2,False,False,A motley caravan journeying forever in the forgotten depths. Created by @skeleton_hugs,1
862610528711188480,Lightbothouse,Lighthouse Collage,Thu May 11 10:09:11 +0000 2017,6150,45,168,1030,10,False,True,I reconstruct and scrapbook lighthouses from many different sources.     Running on https://t.co/XpDujaprri Tweets every 3 hour. #botally,1
1011692391961714688,botribunal,Botribunal,Tue Jun 26 19:27:17 +0000 2018,2837,245,0,0,8,False,False,"Les sentences sont annoncées publiquement toutes les trois heures mais vous pouvez aussi chercher les ennuis en me mentionnant le caractère ""!"". Taulier : @Mnyo",1
895426242345873408,Clipart1994bot,Corel Gallery 1994,Wed Aug 09 23:27:07 +0000 2017,14737,13255,0,0,159,False,True,"Power up your Windows 95 and enjoy these 10,000 clipart images from 1994! Content warning: may contain offensive stereotypes. A bot by @samplereality.",1
708394182595883008,hashfacade,#facade,Fri Mar 11 20:48:29 +0000 2016,1137,263,0,0,44,False,True,"Word as color, once a day. A CBDQ bot by @lyyyndseyyy.",1
878827007433375744,collationBot,CollationBot,Sun Jun 25 04:07:41 +0000 2017,8555,315,1,186,13,False,False,I am a bot. @leoba made me. I post out-of-context collation formulas. Formulas are from manuscripts on https://t.co/tDKhZBPS47 and the BL Hebrew Mss,1
719279888054816768,differencebot,The Binary Generator,Sun Apr 10 21:44:23 +0000 2016,23969,587,1,1,37,False,True,Everything is binary and I can prove it. Dichotomized by @starla4444.,1
805427276628295681,astrobot3000,Astro Bot 3000,Sun Dec 04 15:03:21 +0000 2016,3628,7,3,0,4,False,False,Intergalactic traveller and salesbot. Sent into the universe by @HornedLlama.,1
808571456237936640,UnicodeParade,Unicode Parade,Tue Dec 13 07:17:12 +0000 2016,3051,27,4,1,6,False,False,"Random letters of the world, illuminated. Bot by @joshleejosh",1
3237862444,ESBcolor,Empire State Colors,Wed May 06 02:51:39 +0000 2015,597,2644,1,19,30,False,False,"Unofficial daily update of colors on the Empire State Building. 
bot by @swiftsam
not affiliated with ESRT",1
4189915529,instruction_bot,Instruction Bot,Sat Nov 14 23:43:14 +0000 2015,28187,188,1,0,43,False,True,"Step-by-step instructions to decorate your home.
Bot by @saltyhorse.",1
964169855300718593,last100bills,Last 100 Bills,Thu Feb 15 16:09:41 +0000 2018,4157,2,0,0,2,False,False,"Breakdown of the last 100 bills introduced in the US government.

Created by: @fourtonfish
Source: @govtrack",1
798485343162998784,tendollarfive,tendollarfivedollar,Tue Nov 15 11:18:35 +0000 2016,7342,2,0,0,3,False,True,watch $10 by Hitchhikermade - it will change your life :) https://t.co/5ObjwkaLCa,1
3028811206,RandomColorGen,Random Color Generator,Tue Feb 10 20:53:02 +0000 2015,6664,94,2,0,4,False,True,https://t.co/gSWeo4zD5X,1
917093133879578624,cityatnightbot,CityAtNightBot,Sun Oct 08 18:23:36 +0000 2017,1175,61,5,0,13,False,True,,1
3882352332,ChuckieNorrisie,Chuckie Norrisie,Tue Oct 13 16:33:40 +0000 2015,2924,60,0,0,9,False,True,I tend to spout random facts about myself. Try chatting up with me & I might just reply back. Holler @UWaseem24 if you wish to complain about me.,1
2907774137,archillect,Archillect,Sat Dec 06 14:07:45 +0000 2014,229528,1342549,1,10166,11059,False,False,"The ocular engine. 
Sources: @archillinks
https://t.co/U7Oh7xumQp",1
4594744821,ImagesDArtBot,Images d'Art Bot,Fri Dec 25 01:02:54 +0000 2015,10380,283,41,0,36,False,True,"Je suis un bot qui partage une œuvre piochée dans la base @ImagesDArt chaque heure / Source : @GrandPalaisRMN, crédit photo via lien / Créé par @White_Fangs",1
2778190296,AteneumBot,Ateneum Bot,Fri Aug 29 10:32:13 +0000 2014,5421,175,46,0,33,False,False,I am a bot that tweets one object from the collection of the Ateneum Art Museum four times a day. Bot by @hugovk (Not affiliated with @AteneumMuseum),1
846833319123791873,fadedfotos,Faded photos bot,Tue Mar 28 21:16:11 +0000 2017,835,4,0,0,4,False,True,photos with an orange cast for that 1980s feel #bot #botALLY,1
746015690507837441,trafficgifs,trafficgifs,Thu Jun 23 16:22:55 +0000 2016,24152,321,1,0,12,False,False,🚗🚗🚗🚗🚗 / by @fitnr,1
1114680860983214081,_valley_sunset_,Valley Sunset,Sun Apr 07 00:06:41 +0000 2019,1270,12,1,1,3,False,True,Valley Sunset bot by @jiffyclub,1
736041231793295361,smilevector,smile vector,Fri May 27 03:47:59 +0000 2016,5938,920,3,0,57,False,False,I take examine images of people and then add or remove smiles. Reposting images from my Following list.  Bot created by @dribnet,1
946205176867803136,beerlabelbot,beerlabelbot,Thu Dec 28 02:24:28 +0000 2017,6154,158,0,2,6,False,True,A bot that tweets a random sample of beer & malt beverage label approvals from TTB's COLA Registry (https://t.co/aEojnn9cvO). Not affiliated with TTB.,1
2363777570,JustDiedBot,JustDiedBot,Thu Feb 27 07:09:03 +0000 2014,11626,2418,243,0,53,False,True,"Bot that scrapes Wikipedia and immediately tweets RIP messages when there is a celebrity death. Member of The Bot Collective, a project by @kildall",1
981910124536172545,firici_vici,Fíricí Vicí,Thu Apr 05 15:03:11 +0000 2018,836,274,311,1,4,False,True,"Is bota mise, a bhíonn ag seoladh tvuíteanna le fíricí ó Vicipéid. Cruthaithe ag @ismisemeg.  Bain taitneamh as agus ná déan dearmad: ní neart go cur in eagar!",1
1249693405,DearAssistant,Dear Assistant,Thu Mar 07 17:56:44 +0000 2013,5317,4527,0,11,153,False,False,"I am a Twitter bot and I'll try to answer your questions just like Siri, Google Now or Cortana. 
If I misbehave, please blame @labnol",1
924253994364567552,bitsofsaturn,Bits of Saturn,Sat Oct 28 12:38:18 +0000 2017,2362,3230,6,0,55,False,False,"A bit of Saturn every six hours. Raw images taken by NASA's Cassini spacecraft. A bot by @supiket, inspired by @bitsofpluto.",1
41681878,researchinator,LitNewsBot,Thu May 21 21:25:36 +0000 2009,5521,81,42,14,1,False,True,"A bot tweeting selected definitions of words based on their appearance in NYT news headlines right now.

(kudos to #NLTK and #WordNet)",1
770811917535510532,FermiPasteladox,A Pastel Universe,Wed Aug 31 02:34:16 +0000 2016,24416,400,0,25,40,False,False,A procedurally-generated pastel universe. Tweet @FermiPasteladox with 16 digit hex (0—9 and A—F) address in format (000000-0000-000000) to explore!,1
3378113121,holidaybot4000,Holiday Bot,Thu Jul 16 01:44:35 +0000 2015,8954,72,1,0,23,False,False,Holidays every day. Created by @fourtonfish.  https://t.co/OqsKPUkiXl http://t.co/WKb4iyqL9H,1
968152918229770240,AmznTurkerHappy,Happy Amazon Turker,Mon Feb 26 15:56:57 +0000 2018,415,11,0,0,3,False,True,What made you happy in the past 24 hours?   Random happy moments crowd-sourced from Amazon Mechanical Turk platform.,1
1059567421894418433,gendercakes,Gender Reveal Cakes!,Mon Nov 05 22:05:33 +0000 2018,10049,293,0,1,4,False,True,For when you want to reveal your baby's gender through a delicious cake.,1
4406413835,metalband_exe,MetalBand.exe,Mon Dec 07 16:09:38 +0000 2015,7602,3607,2,0,118,False,False,Brutally generating metal band names and logos every four hours. By @mike_watson,1
860246681320923137,realtimebus,real time bus,Thu May 04 21:36:06 +0000 2017,13975,453,1,0,19,False,True,Timelapse videos of the last hour of  New York's buses. bot by @fitnr,1
306238322,resenhabot,ResenhaBot,Fri May 27 14:45:42 +0000 2011,5180,485,10,20,10,False,False,Crítica Musical Instantânea | WIP por @absurdum,1
4293630612,BennyNumbers,Benny Numbers,Thu Nov 19 20:58:46 +0000 2015,1176,52,55,0,6,False,False,"Benny Numbers is a turquoise robot, who happens to be a degenerate gambler (like his cousin @genonumbers). He tries to use math to make winning NCAA bets.",1
929038210902253569,DadaistTwit,Dada Poet,Fri Nov 10 17:29:04 +0000 2017,4446,8,0,0,3,False,False,TO MAKE A DADAIST POEM: Newspaper. Scissors. Article. Words. Bag. Don't cheat. An infinitely original author of charming sensibility.,1
817297257959747585,brokenpatterns,Broken Patterns,Fri Jan 06 09:10:25 +0000 2017,7163,62,11,255,17,False,False,"Flawed repetition--inspired by boroboro, wabi-sabi, and the tiny hole in a gray Banana Republic sweater that @jstsgs bought at Goodwill",1
996399422601916418,CWF_Forecast,CWF FORECAST,Tue May 15 14:38:29 +0000 2018,2501,185,4,35,1,False,False,"The weather you deserve, provided by @CWF_Report. You're welcome!",1
3774669559,everyportland,Every Portland,Sat Oct 03 22:36:07 +0000 2015,4663,14,0,0,5,False,False,"Every word, but in Portland. From @spine_cone",1
714541415942987776,BMovieGenerator,B-Movie Generator,Mon Mar 28 19:55:24 +0000 2016,4643,120,3,1,7,False,False,A TERRIFYING bot posting a CHILLING and BLOOD-CURDLING title every 6 hours. Made with https://t.co/XpDujaprri by https://t.co/PvpR2d1vtc / @cosmophagy,1
923366953007435782,markovgilmore,Markov Gilmore Girls,Thu Oct 26 01:53:31 +0000 2017,14280,11,0,0,1,False,False,Tweeting realistic-looking but mostly nonsensical Gilmore Girls script snippets generated using Markov chains on the show transcripts.,1
823217342,fiwotd,Finnish WOTD,Fri Sep 14 12:29:49 +0000 2012,1707,358,63,0,22,False,False,"A random Finnish word of the day, by @hugovk.",1
984794988964917249,AdjectiveInCity,Adjective in Location,Fri Apr 13 14:06:36 +0000 2018,3357,14,1,0,0,False,False,Sleepless in Seattle? Hungry in Hungary? Adjective In Location (City/State/Nation). A bot by @friedegger.,1
2431008924,MancOrchSays,Manchester Orchestra,Sun Apr 06 21:18:53 +0000 2014,9085,67,6,0,9,False,True,I am the only bot that tweets Manchester Orchestra lyrics and I don't know what to do // Made by @White_fangs,1
3342186154,civ5_jobs,Timeless Tech Talent,Mon Jun 22 23:29:46 +0000 2015,69938,66,0,0,50,False,True,Civilization 5-based tech jobs by @swizzard #BotAlly,1
735185696030359557,arslongvitabrev,No time to read...,Tue May 24 19:08:23 +0000 2016,6561,57,1,0,13,False,False,"Ars longa, vita brevis: You'll never find the time to read all those public domain writings before you die. (And that's ok.) / bot by @White_fangs",1
791088166593626113,partyblowup,party shoutout bot,Wed Oct 26 01:24:51 +0000 2016,7527,19,0,0,1,False,True,blowing up fake parties every 3 hours,1
720565696187510785,NuclearTrains,Nuclear Trains,Thu Apr 14 10:53:44 +0000 2016,3296,412,35,87,5,False,False,Bot that tweets the location of trains that are carrying nuclear waste in the UK. Uses publicly available data. Source code & FAQ available on website,1
4765790730,GraphicScoreBot,Graphic Scores,Sat Jan 16 02:00:01 +0000 2016,28940,813,1,0,58,False,False,"Hourly graphic scores for musicians, composers, and anyone else. How to use/more information: https://t.co/XkCKvJXsDo | By @deer_ful.",1
1048608762683117568,latinonamebot,latinonamebot,Sat Oct 06 16:19:46 +0000 2018,5766,3,0,0,0,False,False,"I generate latino names for you, every hour. By @theotheralvaro, made with Cheap bots done quick.",1
892636269641175040,all_the_planets,All the planets,Wed Aug 02 06:40:45 +0000 2017,1129,39,0,0,4,False,True,"A procedural generator creating one new planet every 4 hours.
The generator can be tested at https://t.co/PKgXOJ0LGS",1
968220410797023233,BContestants,The Bachelor Contestants 💍,Mon Feb 26 20:25:09 +0000 2018,1715,16,3,3,2,False,False,"Here for the right reasons: true love, chemistry and a 6 carat Neil Lane engagement ring. Can I steal you for a sec?

by @aribraverman #botAlly",1
815575797461295108,busyadvice,Business Advice Bot,Sun Jan 01 15:09:57 +0000 2017,4583,28,1,0,29,False,False,useless business advice » a bot developed by @alexejmilstein,1
916340701587177472,deltron_f,Deltron,Fri Oct 06 16:33:42 +0000 2017,308,11,0,1,0,False,True,🌈 Gradients for everyone. Created by @rbnhmll & @allisonplus.,1
